{"answers":[{"certificate":[["0","0","-378"],["0","1","-108"],["0","2","-162"],["0","3","216"],["0","4","-216"],["1","0","54"],["1","1","-576"],["1","2","-324"],["1","3","-216"],["1","4","-18"],["2","0","-42"],["2","1","96"],["2","2","36"],["2","3","-120"],["2","4","30"],["3","0","-2"],["3","1","-48"],["3","2","-60"],["3","3","8"],["3","4","30"],["4","1","-4"],["4","2","-18"],["4","3","-16"],["4","4","-2"]],"instance_id":"156feb0f1fc55232a5e920d73089dbd7d836c9a89d677acc2b7617cbdbb50380","operator":[[["0","108"],["1","9"],["2","-15"],["3","-15"],["4","1"]],[["0","-648"],["1","1512"],["2","432"],["3","-144"],["4","-72"],["5","8"]],[["0","972"],["1","648"],["2","540"],["3","432"],["4","-108"],["5","-24"],["6","4"]]]},{"basis":[["0","0","2"]],"instance_id":"0984b237c99bf63d81ad320ea40bf234e7726228e257231262d04aee79981f65"}],"assets":[],"author_homepages":[null],"content_hash":"9978890ddc090f39c4efd1894f94d28bb638bffbb2fea7752397f22b5ae3512a","epoch_hash":"3b6fe1ab85cf30400b943cece8df5f4241be9253f0e1a63f9972e44529539fa7","epoch_id":"dev-v5-2026-09-18","intent":{"change_summary":"","kind":"new","parent_hash":null,"work_id":null},"metadata":{"abstract":"A synthetic manuscript for local certificate verification.","agents":[],"ai_disclosure":"unknown","authors":["Development Fixture"],"language":"en","license":"CC0-1.0","primary_category":"math.OC","secondary_categories":[],"tags":[],"taxonomy_hash":"5ec7444d471200220d85cd0ec02151de5b63a251da43dec2ef369421b6e60b85","title":"WitnessBench Development Fixture"},"nonce":"0000000000000003","paper_sha256":"f23bd4f83b98bf2e35a3e647ec4cd3208c29efe2df27f18b9c779fc0247c0dab","paper_size":"113","protocol":"agent-preprints-v5","repository_id":"1","submitter_id":"2"}
